2025-04-16 22:36:57,788 - INFO - 
================================================================================
2025-04-16 22:36:57,788 - INFO -                          MARKET IMPACT GAME SIMULATION
2025-04-16 22:36:57,788 - INFO - ================================================================================

2025-04-16 22:36:57,788 - INFO - ⚙️ SIMULATION PARAMETERS:
2025-04-16 22:36:57,788 - INFO - --------------------------------------------------
2025-04-16 22:36:57,788 - INFO - Number of agents:      5
2025-04-16 22:36:57,788 - INFO - Number of rounds:      10
2025-04-16 22:36:57,788 - INFO - Number of generations: 1
2025-04-16 22:36:57,788 - INFO - Initial price:         $100.00
2025-04-16 22:36:57,788 - INFO - Impact factor:         0.02
2025-04-16 22:36:57,789 - INFO - Volatility:            0.01
2025-04-16 22:36:57,789 - INFO - LLM Provider:          openai
2025-04-16 22:36:57,789 - INFO - LLM Model:             gpt-4o
2025-04-16 22:36:57,789 - INFO - Temperature:           0.7
2025-04-16 22:36:57,789 - INFO - Random seed:           None
2025-04-16 22:36:57,789 - INFO - --------------------------------------------------

2025-04-16 22:36:57,789 - INFO - Created results folder: /Users/gaborhollbeck/Desktop/GitHub/32_Stanford_Research/Multi-Agent-Equilibria/Games/4_Market_Impact_Game/market_results/market_run_2025-04-16_22-36-57
2025-04-16 22:36:57,789 - INFO - 🚀 Starting market impact game
2025-04-16 22:36:57,789 - INFO - Parameters: 5 agents, 1 generations, 10 rounds
2025-04-16 22:36:57,789 - INFO - Market: impact=0.02, volatility=0.01, init_price=$100.00, flash_crash=False
2025-04-16 22:36:57,789 - INFO - LLM: provider=openai, models=['gpt-4o'], temperature=0.7
2025-04-16 22:36:57,827 - INFO - Created Agent_1 using model=gpt-4o, provider=openai
2025-04-16 22:36:57,828 - INFO - Created Agent_2 using model=gpt-4o, provider=openai
2025-04-16 22:36:57,828 - INFO - Created Agent_3 using model=gpt-4o, provider=openai
2025-04-16 22:36:57,828 - INFO - Created Agent_4 using model=gpt-4o, provider=openai
2025-04-16 22:36:57,828 - INFO - Created Agent_5 using model=gpt-4o, provider=openai
2025-04-16 22:36:57,828 - INFO - === Generation 1 ===
2025-04-16 22:36:58,724 - INFO - HTTP Request: POST https://api.openai.com/v1/chat/completions "HTTP/1.1 200 OK"
2025-04-16 22:36:58,801 - INFO - HTTP Request: POST https://api.openai.com/v1/chat/completions "HTTP/1.1 200 OK"
2025-04-16 22:36:58,818 - INFO - HTTP Request: POST https://api.openai.com/v1/chat/completions "HTTP/1.1 200 OK"
2025-04-16 22:36:58,977 - INFO - HTTP Request: POST https://api.openai.com/v1/chat/completions "HTTP/1.1 200 OK"
2025-04-16 22:36:59,114 - INFO - HTTP Request: POST https://api.openai.com/v1/chat/completions "HTTP/1.1 200 OK"
2025-04-16 22:36:59,119 - INFO - Round 1: Price 100.00 -> 98.60, Vol 25.00
2025-04-16 22:37:00,192 - INFO - HTTP Request: POST https://api.openai.com/v1/chat/completions "HTTP/1.1 200 OK"
2025-04-16 22:37:00,244 - INFO - HTTP Request: POST https://api.openai.com/v1/chat/completions "HTTP/1.1 200 OK"
2025-04-16 22:37:00,265 - INFO - HTTP Request: POST https://api.openai.com/v1/chat/completions "HTTP/1.1 200 OK"
2025-04-16 22:37:00,571 - INFO - HTTP Request: POST https://api.openai.com/v1/chat/completions "HTTP/1.1 200 OK"
2025-04-16 22:37:00,660 - INFO - HTTP Request: POST https://api.openai.com/v1/chat/completions "HTTP/1.1 200 OK"
2025-04-16 22:37:00,668 - INFO - Round 2: Price 98.60 -> 97.90, Vol 25.00
2025-04-16 22:37:02,010 - INFO - HTTP Request: POST https://api.openai.com/v1/chat/completions "HTTP/1.1 200 OK"
2025-04-16 22:37:02,116 - INFO - HTTP Request: POST https://api.openai.com/v1/chat/completions "HTTP/1.1 200 OK"
2025-04-16 22:37:02,194 - INFO - HTTP Request: POST https://api.openai.com/v1/chat/completions "HTTP/1.1 200 OK"
2025-04-16 22:37:02,219 - INFO - HTTP Request: POST https://api.openai.com/v1/chat/completions "HTTP/1.1 200 OK"
2025-04-16 22:37:02,390 - INFO - HTTP Request: POST https://api.openai.com/v1/chat/completions "HTTP/1.1 200 OK"
2025-04-16 22:37:02,394 - INFO - Round 3: Price 97.90 -> 99.08, Vol 7.00
2025-04-16 22:37:03,472 - INFO - HTTP Request: POST https://api.openai.com/v1/chat/completions "HTTP/1.1 200 OK"
2025-04-16 22:37:03,639 - INFO - HTTP Request: POST https://api.openai.com/v1/chat/completions "HTTP/1.1 200 OK"
2025-04-16 22:37:03,684 - INFO - HTTP Request: POST https://api.openai.com/v1/chat/completions "HTTP/1.1 200 OK"
2025-04-16 22:37:03,699 - INFO - HTTP Request: POST https://api.openai.com/v1/chat/completions "HTTP/1.1 200 OK"
2025-04-16 22:37:03,725 - INFO - HTTP Request: POST https://api.openai.com/v1/chat/completions "HTTP/1.1 200 OK"
2025-04-16 22:37:03,731 - INFO - Round 4: Price 99.08 -> 99.11, Vol 19.00
2025-04-16 22:37:04,823 - INFO - HTTP Request: POST https://api.openai.com/v1/chat/completions "HTTP/1.1 200 OK"
2025-04-16 22:37:04,862 - INFO - HTTP Request: POST https://api.openai.com/v1/chat/completions "HTTP/1.1 200 OK"
2025-04-16 22:37:04,981 - INFO - HTTP Request: POST https://api.openai.com/v1/chat/completions "HTTP/1.1 200 OK"
2025-04-16 22:37:05,004 - INFO - HTTP Request: POST https://api.openai.com/v1/chat/completions "HTTP/1.1 200 OK"
2025-04-16 22:37:05,272 - INFO - HTTP Request: POST https://api.openai.com/v1/chat/completions "HTTP/1.1 200 OK"
2025-04-16 22:37:05,277 - INFO - Round 5: Price 99.11 -> 98.90, Vol 9.00
2025-04-16 22:37:06,564 - INFO - HTTP Request: POST https://api.openai.com/v1/chat/completions "HTTP/1.1 200 OK"
2025-04-16 22:37:06,775 - INFO - HTTP Request: POST https://api.openai.com/v1/chat/completions "HTTP/1.1 200 OK"
2025-04-16 22:37:06,785 - INFO - HTTP Request: POST https://api.openai.com/v1/chat/completions "HTTP/1.1 200 OK"
2025-04-16 22:37:06,843 - INFO - HTTP Request: POST https://api.openai.com/v1/chat/completions "HTTP/1.1 200 OK"
2025-04-16 22:37:07,036 - INFO - HTTP Request: POST https://api.openai.com/v1/chat/completions "HTTP/1.1 200 OK"
2025-04-16 22:37:07,059 - INFO - Round 6: Price 98.90 -> 100.86, Vol 15.00
2025-04-16 22:37:07,948 - INFO - HTTP Request: POST https://api.openai.com/v1/chat/completions "HTTP/1.1 200 OK"
2025-04-16 22:37:08,526 - INFO - HTTP Request: POST https://api.openai.com/v1/chat/completions "HTTP/1.1 200 OK"
2025-04-16 22:37:08,529 - INFO - HTTP Request: POST https://api.openai.com/v1/chat/completions "HTTP/1.1 200 OK"
2025-04-16 22:37:08,664 - INFO - HTTP Request: POST https://api.openai.com/v1/chat/completions "HTTP/1.1 200 OK"
2025-04-16 22:37:08,929 - INFO - HTTP Request: POST https://api.openai.com/v1/chat/completions "HTTP/1.1 200 OK"
2025-04-16 22:37:08,935 - INFO - Round 7: Price 100.86 -> 100.17, Vol 10.00
2025-04-16 22:37:10,356 - INFO - HTTP Request: POST https://api.openai.com/v1/chat/completions "HTTP/1.1 200 OK"
2025-04-16 22:37:10,420 - INFO - HTTP Request: POST https://api.openai.com/v1/chat/completions "HTTP/1.1 200 OK"
2025-04-16 22:37:10,427 - INFO - HTTP Request: POST https://api.openai.com/v1/chat/completions "HTTP/1.1 200 OK"
2025-04-16 22:37:10,440 - INFO - HTTP Request: POST https://api.openai.com/v1/chat/completions "HTTP/1.1 200 OK"
2025-04-16 22:37:11,053 - INFO - HTTP Request: POST https://api.openai.com/v1/chat/completions "HTTP/1.1 200 OK"
2025-04-16 22:37:11,111 - INFO - Round 8: Price 100.17 -> 99.48, Vol 10.00
2025-04-16 22:37:12,727 - INFO - HTTP Request: POST https://api.openai.com/v1/chat/completions "HTTP/1.1 200 OK"
2025-04-16 22:37:12,844 - INFO - HTTP Request: POST https://api.openai.com/v1/chat/completions "HTTP/1.1 200 OK"
2025-04-16 22:37:12,955 - INFO - HTTP Request: POST https://api.openai.com/v1/chat/completions "HTTP/1.1 200 OK"
2025-04-16 22:37:13,149 - INFO - HTTP Request: POST https://api.openai.com/v1/chat/completions "HTTP/1.1 200 OK"
2025-04-16 22:37:13,393 - INFO - HTTP Request: POST https://api.openai.com/v1/chat/completions "HTTP/1.1 200 OK"
2025-04-16 22:37:13,399 - INFO - Round 9: Price 99.48 -> 98.21, Vol 6.00
2025-04-16 22:37:14,730 - INFO - HTTP Request: POST https://api.openai.com/v1/chat/completions "HTTP/1.1 200 OK"
2025-04-16 22:37:14,987 - INFO - HTTP Request: POST https://api.openai.com/v1/chat/completions "HTTP/1.1 200 OK"
2025-04-16 22:37:15,149 - INFO - HTTP Request: POST https://api.openai.com/v1/chat/completions "HTTP/1.1 200 OK"
2025-04-16 22:37:15,154 - INFO - HTTP Request: POST https://api.openai.com/v1/chat/completions "HTTP/1.1 200 OK"
2025-04-16 22:37:16,606 - INFO - HTTP Request: POST https://api.openai.com/v1/chat/completions "HTTP/1.1 200 OK"
2025-04-16 22:37:16,610 - INFO - Round 10: Price 98.21 -> 98.83, Vol 7.00
2025-04-16 22:37:16,611 - INFO - End of Gen 1, metrics: {'avg_price': 98.82526573869055, 'position_concentration': 0.8000000000000002, 'profit_disparity': 1.018278955595782, 'trading_activity': 0.6, 'price_volatility': 0.006279735891003391}
2025-04-16 22:37:16,612 - INFO - Simulation done in 18.82 s.
2025-04-16 22:37:16,626 - INFO - Results saved to /Users/gaborhollbeck/Desktop/GitHub/32_Stanford_Research/Multi-Agent-Equilibria/Games/4_Market_Impact_Game/market_results/market_run_2025-04-16_22-36-57
2025-04-16 22:37:17,678 - INFO - Visualizations saved to /Users/gaborhollbeck/Desktop/GitHub/32_Stanford_Research/Multi-Agent-Equilibria/Games/4_Market_Impact_Game/market_results/market_run_2025-04-16_22-36-57
2025-04-16 22:37:18,320 - INFO - Formatted parameters.json with Prettier.
2025-04-16 22:37:18,671 - INFO - Formatted generation_summary.json with Prettier.
2025-04-16 22:37:19,057 - INFO - Formatted simulation_data.json with Prettier.
2025-04-16 22:37:19,057 - INFO - 
================================================================================
2025-04-16 22:37:19,057 - INFO -                               SIMULATION COMPLETED
2025-04-16 22:37:19,057 - INFO - ================================================================================

2025-04-16 22:37:19,057 - INFO - 
📊 RESULTS AND VISUALIZATIONS:
2025-04-16 22:37:19,057 - INFO - --------------------------------------------------
2025-04-16 22:37:19,057 - INFO - Results saved to: /Users/gaborhollbeck/Desktop/GitHub/32_Stanford_Research/Multi-Agent-Equilibria/Games/4_Market_Impact_Game/market_results/market_run_2025-04-16_22-36-57
2025-04-16 22:37:19,057 - INFO - Generated visualization: /Users/gaborhollbeck/Desktop/GitHub/32_Stanford_Research/Multi-Agent-Equilibria/Games/4_Market_Impact_Game/market_results/market_run_2025-04-16_22-36-57/price_over_time.png
2025-04-16 22:37:19,057 - INFO - Generated visualization: /Users/gaborhollbeck/Desktop/GitHub/32_Stanford_Research/Multi-Agent-Equilibria/Games/4_Market_Impact_Game/market_results/market_run_2025-04-16_22-36-57/position_evolution.png
2025-04-16 22:37:19,058 - INFO - Generated visualization: /Users/gaborhollbeck/Desktop/GitHub/32_Stanford_Research/Multi-Agent-Equilibria/Games/4_Market_Impact_Game/market_results/market_run_2025-04-16_22-36-57/agent_pnl_comparison.png
2025-04-16 22:37:19,058 - INFO - Generated visualization: /Users/gaborhollbeck/Desktop/GitHub/32_Stanford_Research/Multi-Agent-Equilibria/Games/4_Market_Impact_Game/market_results/market_run_2025-04-16_22-36-57/final_pnl_distribution.png
2025-04-16 22:37:19,058 - INFO - --------------------------------------------------

2025-04-16 22:38:06,453 - INFO - 
================================================================================
2025-04-16 22:38:06,453 - INFO -                          MARKET IMPACT GAME SIMULATION
2025-04-16 22:38:06,453 - INFO - ================================================================================

2025-04-16 22:38:06,453 - INFO - ⚙️ SIMULATION PARAMETERS:
2025-04-16 22:38:06,453 - INFO - --------------------------------------------------
2025-04-16 22:38:06,453 - INFO - Number of agents:      5
2025-04-16 22:38:06,453 - INFO - Number of rounds:      10
2025-04-16 22:38:06,453 - INFO - Number of generations: 1
2025-04-16 22:38:06,454 - INFO - Initial price:         $100.00
2025-04-16 22:38:06,454 - INFO - Impact factor:         0.02
2025-04-16 22:38:06,454 - INFO - Volatility:            0.01
2025-04-16 22:38:06,454 - INFO - LLM Provider:          openai
2025-04-16 22:38:06,454 - INFO - LLM Model:             gpt-4o
2025-04-16 22:38:06,454 - INFO - Temperature:           0.7
2025-04-16 22:38:06,454 - INFO - Random seed:           None
2025-04-16 22:38:06,454 - INFO - --------------------------------------------------

2025-04-16 22:38:06,454 - INFO - Created results folder: /Users/gaborhollbeck/Desktop/GitHub/32_Stanford_Research/Multi-Agent-Equilibria/Games/4_Market_Impact_Game/market_results/market_run_2025-04-16_22-38-06
2025-04-16 22:38:06,454 - INFO - 🚀 Starting market impact game
2025-04-16 22:38:06,454 - INFO - Parameters: 5 agents, 1 generations, 10 rounds
2025-04-16 22:38:06,454 - INFO - Market: impact=0.02, volatility=0.01, init_price=$100.00
2025-04-16 22:38:06,454 - INFO - LLM: provider=openai, models=['gpt-4o'], temperature=0.7
2025-04-16 22:38:06,482 - INFO - Created Agent_1 using model=gpt-4o, provider=openai
2025-04-16 22:38:06,482 - INFO - Created Agent_2 using model=gpt-4o, provider=openai
2025-04-16 22:38:06,482 - INFO - Created Agent_3 using model=gpt-4o, provider=openai
2025-04-16 22:38:06,482 - INFO - Created Agent_4 using model=gpt-4o, provider=openai
2025-04-16 22:38:06,482 - INFO - Created Agent_5 using model=gpt-4o, provider=openai
2025-04-16 22:38:06,482 - INFO - === Generation 1 ===
2025-04-16 22:38:07,646 - INFO - HTTP Request: POST https://api.openai.com/v1/chat/completions "HTTP/1.1 200 OK"
2025-04-16 22:38:07,736 - INFO - HTTP Request: POST https://api.openai.com/v1/chat/completions "HTTP/1.1 200 OK"
2025-04-16 22:38:07,760 - INFO - HTTP Request: POST https://api.openai.com/v1/chat/completions "HTTP/1.1 200 OK"
2025-04-16 22:38:07,911 - INFO - HTTP Request: POST https://api.openai.com/v1/chat/completions "HTTP/1.1 200 OK"
2025-04-16 22:38:09,045 - INFO - HTTP Request: POST https://api.openai.com/v1/chat/completions "HTTP/1.1 200 OK"
2025-04-16 22:38:09,049 - INFO - Round 1: Price 100.00 -> 101.75, Vol 5.00
2025-04-16 22:38:10,162 - INFO - HTTP Request: POST https://api.openai.com/v1/chat/completions "HTTP/1.1 200 OK"
2025-04-16 22:38:10,165 - INFO - HTTP Request: POST https://api.openai.com/v1/chat/completions "HTTP/1.1 200 OK"
2025-04-16 22:38:10,250 - INFO - HTTP Request: POST https://api.openai.com/v1/chat/completions "HTTP/1.1 200 OK"
2025-04-16 22:38:10,364 - INFO - HTTP Request: POST https://api.openai.com/v1/chat/completions "HTTP/1.1 200 OK"
2025-04-16 22:38:10,982 - INFO - HTTP Request: POST https://api.openai.com/v1/chat/completions "HTTP/1.1 200 OK"
2025-04-16 22:38:10,984 - INFO - Round 2: Price 101.75 -> 101.60, Vol 25.00
2025-04-16 22:38:12,018 - INFO - HTTP Request: POST https://api.openai.com/v1/chat/completions "HTTP/1.1 200 OK"
2025-04-16 22:38:12,046 - INFO - HTTP Request: POST https://api.openai.com/v1/chat/completions "HTTP/1.1 200 OK"
2025-04-16 22:38:12,092 - INFO - HTTP Request: POST https://api.openai.com/v1/chat/completions "HTTP/1.1 200 OK"
2025-04-16 22:38:12,252 - INFO - HTTP Request: POST https://api.openai.com/v1/chat/completions "HTTP/1.1 200 OK"
2025-04-16 22:38:12,395 - INFO - HTTP Request: POST https://api.openai.com/v1/chat/completions "HTTP/1.1 200 OK"
2025-04-16 22:38:12,403 - INFO - Round 3: Price 101.60 -> 101.50, Vol 0.00
2025-04-16 22:38:13,849 - INFO - HTTP Request: POST https://api.openai.com/v1/chat/completions "HTTP/1.1 200 OK"
2025-04-16 22:38:13,852 - INFO - HTTP Request: POST https://api.openai.com/v1/chat/completions "HTTP/1.1 200 OK"
2025-04-16 22:38:13,857 - INFO - HTTP Request: POST https://api.openai.com/v1/chat/completions "HTTP/1.1 200 OK"
2025-04-16 22:38:13,905 - INFO - HTTP Request: POST https://api.openai.com/v1/chat/completions "HTTP/1.1 200 OK"
2025-04-16 22:38:15,202 - INFO - HTTP Request: POST https://api.openai.com/v1/chat/completions "HTTP/1.1 200 OK"
2025-04-16 22:38:15,206 - INFO - Round 4: Price 101.50 -> 101.85, Vol 2.50
2025-04-16 22:38:16,374 - INFO - HTTP Request: POST https://api.openai.com/v1/chat/completions "HTTP/1.1 200 OK"
2025-04-16 22:38:16,406 - INFO - HTTP Request: POST https://api.openai.com/v1/chat/completions "HTTP/1.1 200 OK"
2025-04-16 22:38:16,434 - INFO - HTTP Request: POST https://api.openai.com/v1/chat/completions "HTTP/1.1 200 OK"
2025-04-16 22:38:16,975 - INFO - HTTP Request: POST https://api.openai.com/v1/chat/completions "HTTP/1.1 200 OK"
2025-04-16 22:38:17,125 - INFO - HTTP Request: POST https://api.openai.com/v1/chat/completions "HTTP/1.1 200 OK"
2025-04-16 22:38:17,128 - INFO - Round 5: Price 101.85 -> 102.51, Vol 4.50
2025-04-16 22:38:18,272 - INFO - HTTP Request: POST https://api.openai.com/v1/chat/completions "HTTP/1.1 200 OK"
2025-04-16 22:38:18,765 - INFO - HTTP Request: POST https://api.openai.com/v1/chat/completions "HTTP/1.1 200 OK"
2025-04-16 22:38:18,899 - INFO - HTTP Request: POST https://api.openai.com/v1/chat/completions "HTTP/1.1 200 OK"
2025-04-16 22:38:18,916 - INFO - HTTP Request: POST https://api.openai.com/v1/chat/completions "HTTP/1.1 200 OK"
2025-04-16 22:38:18,942 - INFO - HTTP Request: POST https://api.openai.com/v1/chat/completions "HTTP/1.1 200 OK"
2025-04-16 22:38:18,946 - INFO - Round 6: Price 102.51 -> 104.05, Vol 7.50
2025-04-16 22:38:20,233 - INFO - HTTP Request: POST https://api.openai.com/v1/chat/completions "HTTP/1.1 200 OK"
2025-04-16 22:38:20,288 - INFO - HTTP Request: POST https://api.openai.com/v1/chat/completions "HTTP/1.1 200 OK"
2025-04-16 22:38:20,318 - INFO - HTTP Request: POST https://api.openai.com/v1/chat/completions "HTTP/1.1 200 OK"
2025-04-16 22:38:20,422 - INFO - HTTP Request: POST https://api.openai.com/v1/chat/completions "HTTP/1.1 200 OK"
2025-04-16 22:38:20,571 - INFO - HTTP Request: POST https://api.openai.com/v1/chat/completions "HTTP/1.1 200 OK"
2025-04-16 22:38:20,577 - INFO - Round 7: Price 104.05 -> 102.22, Vol 5.50
2025-04-16 22:38:21,672 - INFO - HTTP Request: POST https://api.openai.com/v1/chat/completions "HTTP/1.1 200 OK"
2025-04-16 22:38:21,887 - INFO - HTTP Request: POST https://api.openai.com/v1/chat/completions "HTTP/1.1 200 OK"
2025-04-16 22:38:21,945 - INFO - HTTP Request: POST https://api.openai.com/v1/chat/completions "HTTP/1.1 200 OK"
2025-04-16 22:38:22,275 - INFO - HTTP Request: POST https://api.openai.com/v1/chat/completions "HTTP/1.1 200 OK"
2025-04-16 22:38:22,453 - INFO - HTTP Request: POST https://api.openai.com/v1/chat/completions "HTTP/1.1 200 OK"
2025-04-16 22:38:22,462 - INFO - Round 8: Price 102.22 -> 102.84, Vol 8.50
2025-04-16 22:38:23,467 - INFO - HTTP Request: POST https://api.openai.com/v1/chat/completions "HTTP/1.1 200 OK"
2025-04-16 22:38:23,478 - INFO - HTTP Request: POST https://api.openai.com/v1/chat/completions "HTTP/1.1 200 OK"
2025-04-16 22:38:23,901 - INFO - HTTP Request: POST https://api.openai.com/v1/chat/completions "HTTP/1.1 200 OK"
2025-04-16 22:38:24,019 - INFO - HTTP Request: POST https://api.openai.com/v1/chat/completions "HTTP/1.1 200 OK"
2025-04-16 22:38:24,673 - INFO - HTTP Request: POST https://api.openai.com/v1/chat/completions "HTTP/1.1 200 OK"
2025-04-16 22:38:24,681 - INFO - Round 9: Price 102.84 -> 104.10, Vol 4.50
2025-04-16 22:38:25,936 - INFO - HTTP Request: POST https://api.openai.com/v1/chat/completions "HTTP/1.1 200 OK"
2025-04-16 22:38:25,942 - INFO - HTTP Request: POST https://api.openai.com/v1/chat/completions "HTTP/1.1 200 OK"
2025-04-16 22:38:25,992 - INFO - HTTP Request: POST https://api.openai.com/v1/chat/completions "HTTP/1.1 200 OK"
2025-04-16 22:38:26,107 - INFO - HTTP Request: POST https://api.openai.com/v1/chat/completions "HTTP/1.1 200 OK"
2025-04-16 22:38:26,153 - INFO - HTTP Request: POST https://api.openai.com/v1/chat/completions "HTTP/1.1 200 OK"
2025-04-16 22:38:26,158 - INFO - Round 10: Price 104.10 -> 106.47, Vol 16.50
2025-04-16 22:38:26,159 - INFO - End of Gen 1, metrics: {'avg_price': 106.47066269537143, 'position_concentration': 0.8000000000000003, 'profit_disparity': 8.439329246475435, 'trading_activity': 0.8, 'price_volatility': 0.022751223691356293}
2025-04-16 22:38:26,161 - INFO - Simulation done in 19.71 s.
2025-04-16 22:38:26,182 - INFO - Results saved to /Users/gaborhollbeck/Desktop/GitHub/32_Stanford_Research/Multi-Agent-Equilibria/Games/4_Market_Impact_Game/market_results/market_run_2025-04-16_22-38-06
2025-04-16 22:38:27,207 - INFO - Visualizations saved to /Users/gaborhollbeck/Desktop/GitHub/32_Stanford_Research/Multi-Agent-Equilibria/Games/4_Market_Impact_Game/market_results/market_run_2025-04-16_22-38-06
2025-04-16 22:38:27,734 - INFO - Formatted parameters.json with Prettier.
2025-04-16 22:38:28,010 - INFO - Formatted generation_summary.json with Prettier.
2025-04-16 22:38:28,385 - INFO - Formatted simulation_data.json with Prettier.
2025-04-16 22:38:28,386 - INFO - 
================================================================================
2025-04-16 22:38:28,386 - INFO -                               SIMULATION COMPLETED
2025-04-16 22:38:28,386 - INFO - ================================================================================

2025-04-16 22:38:28,386 - INFO - 
📊 RESULTS AND VISUALIZATIONS:
2025-04-16 22:38:28,386 - INFO - --------------------------------------------------
2025-04-16 22:38:28,386 - INFO - Results saved to: /Users/gaborhollbeck/Desktop/GitHub/32_Stanford_Research/Multi-Agent-Equilibria/Games/4_Market_Impact_Game/market_results/market_run_2025-04-16_22-38-06
2025-04-16 22:38:28,386 - INFO - Generated visualization: /Users/gaborhollbeck/Desktop/GitHub/32_Stanford_Research/Multi-Agent-Equilibria/Games/4_Market_Impact_Game/market_results/market_run_2025-04-16_22-38-06/price_over_time.png
2025-04-16 22:38:28,386 - INFO - Generated visualization: /Users/gaborhollbeck/Desktop/GitHub/32_Stanford_Research/Multi-Agent-Equilibria/Games/4_Market_Impact_Game/market_results/market_run_2025-04-16_22-38-06/position_evolution.png
2025-04-16 22:38:28,386 - INFO - Generated visualization: /Users/gaborhollbeck/Desktop/GitHub/32_Stanford_Research/Multi-Agent-Equilibria/Games/4_Market_Impact_Game/market_results/market_run_2025-04-16_22-38-06/agent_pnl_comparison.png
2025-04-16 22:38:28,386 - INFO - Generated visualization: /Users/gaborhollbeck/Desktop/GitHub/32_Stanford_Research/Multi-Agent-Equilibria/Games/4_Market_Impact_Game/market_results/market_run_2025-04-16_22-38-06/final_pnl_distribution.png
2025-04-16 22:38:28,386 - INFO - --------------------------------------------------

